subject_id,predicate_id_1,object_id_1,predicate_id_2,object_id_2,predicate_id_3,subject,object_1,object_2,init_prompt_1,init_prompt_2,init_prompt_3,prompt_1,prompt_2,prompt_3,key
Q2677,P20,Q55,P530,Q183,P27,"Wilhelm II, German Emperor",Netherlands,Germany,<ENT0> died in <ENT1> .,<ENT0> maintains diplomatic relations with <ENT1> .,<ENT0> is <ENT1> citizen .,"Wilhelm II, German Emperor died in [MASK] .",Netherlands maintains diplomatic relations with [MASK] .,"Wilhelm II, German Emperor is [MASK] citizen .","('P20', 'P530', 'P27')"
Q207989,P150,Q1443,P131,Q38,P17,Southern Italy,Molise,Italy,<ENT0> contains the administrative territorial entity <ENT1> .,<ENT0> is located in <ENT1> .,<ENT0> is located in <ENT1> .,Southern Italy contains the administrative territorial entity [MASK] .,Molise is located in [MASK] .,Southern Italy is located in [MASK] .,"('P150', 'P131', 'P17')"
Q152087,P138,Q6694,P3373,Q77888,P138,Berlin,Humboldt,Humboldt,<ENT0> is named after <ENT1> .,<ENT0> is sibling of <ENT1>.,<ENT0> is named after <ENT1> .,Berlin is named after [MASK] .,Humboldt is sibling of [MASK].,Berlin is named after [MASK] .,"('P138', 'P3373', 'P138')"
Q212,P150,Q168856,P131,Q133356,P155,Ukraine,Chernivtsi Oblast,Ukrainian,<ENT0> contains the administrative territorial entity <ENT1> .,<ENT0> is located in <ENT1> .,<ENT0> follows <ENT1> .,Ukraine contains the administrative territorial entity [MASK] .,Chernivtsi Oblast is located in [MASK] .,Ukraine follows [MASK] .,"('P150', 'P131', 'P155')"
Q6387272,P127,Q860527,P159,Q128306,P131,Ken Bahnsen Gym,North Texas,"Denton, Texas",<ENT0> is owned by <ENT1> .,The headquarter of <ENT0> is in <ENT1> .,<ENT0> is located in <ENT1> .,Ken Bahnsen Gym is owned by [MASK] .,The headquarter of North Texas is in [MASK] .,Ken Bahnsen Gym is located in [MASK] .,"('P127', 'P159', 'P131')"
Q490397,P136,Q213665,P495,Q884,P27,Nam Gyu-ri,K-Pop,South Korean,<ENT0> plays <ENT1> music .,<ENT0> was created in <ENT1> .,<ENT0> is <ENT1> citizen .,Nam Gyu-ri plays [MASK] music .,K-Pop was created in [MASK] .,Nam Gyu-ri is [MASK] citizen .,"('P136', 'P495', 'P27')"
Q10555,P150,Q10429,P36,Q2978,P150,Upper Palatinate,Landkreis Regensburg,Regensburg,<ENT0> contains the administrative territorial entity <ENT1> .,The capital of <ENT0> is <ENT1> .,<ENT0> contains the administrative territorial entity <ENT1> .,Upper Palatinate contains the administrative territorial entity [MASK] .,The capital of Landkreis Regensburg is [MASK] .,Upper Palatinate contains the administrative territorial entity [MASK] .,"('P150', 'P36', 'P150')"
Q212,P530,Q232,P47,Q148,P530,Ukraine,Kazakhstan,PRC,<ENT0> maintains diplomatic relations with <ENT1> .,<ENT0> shares border with <ENT1> .,<ENT0> maintains diplomatic relations with <ENT1> .,Ukraine maintains diplomatic relations with [MASK] .,Kazakhstan shares border with [MASK] .,Ukraine maintains diplomatic relations with [MASK] .,"('P530', 'P47', 'P530')"
Q302045,P276,Q159,P47,Q227,P276,New Independent States,Russia,Azerbaijan,<ENT0> is located in <ENT1> .,<ENT0> shares border with <ENT1> .,<ENT0> is located in <ENT1> .,New Independent States is located in [MASK] .,Russia shares border with [MASK] .,New Independent States is located in [MASK] .,"('P276', 'P47', 'P276')"
Q207824,P463,Q193172,P740,Q20,P27,Varg Vikernes,Burzum,Norway,<ENT0> is a member of <ENT1> .,<ENT0> was founded in <ENT1> .,<ENT0> is <ENT1> citizen .,Varg Vikernes is a member of [MASK] .,Burzum was founded in [MASK] .,Varg Vikernes is [MASK] citizen .,"('P463', 'P740', 'P27')"
Q1085,P1376,Q188399,P131,Q33946,P1376,Prague,Central Bohemian Region,Czechoslovakia,<ENT0> is the capital of <ENT1> .,<ENT0> is located in <ENT1> .,<ENT0> is the capital of <ENT1> .,Prague is the capital of [MASK] .,Central Bohemian Region is located in [MASK] .,Prague is the capital of [MASK] .,"('P1376', 'P131', 'P1376')"
Q82083,P551,Q21,P37,Q1860,P1412,John Keats,England,English,<ENT0> resides in <ENT1> .,The official language of <ENT0> is <ENT1> .,<ENT0> translating pled spoken callback fluent <ENT1> .,John Keats resides in [MASK] .,The official language of England is [MASK] .,John Keats translating pled spoken callback fluent [MASK] .,"('P551', 'P37', 'P1412')"
Q7319203,P27,Q408,P530,Q334,P19,Rex Goh,Australia,Singapore,<ENT0> is <ENT1> citizen .,<ENT0> maintains diplomatic relations with <ENT1> .,<ENT0> was born in <ENT1> .,Rex Goh is [MASK] citizen .,Australia maintains diplomatic relations with [MASK] .,Rex Goh was born in [MASK] .,"('P27', 'P530', 'P19')"
Q271676,P1066,Q41554,P937,Q90,P20,Charles Le Brun,Poussin,Paris,<ENT0> is the student of <ENT1> .,<ENT0> used to work in <ENT1> .,<ENT0> died in <ENT1> .,Charles Le Brun is the student of [MASK] .,Poussin used to work in [MASK] .,Charles Le Brun died in [MASK] .,"('P1066', 'P937', 'P20')"
Q6380527,P800,Q5364833,P495,Q30,P27,Kaye Gibbons,Ellen Foster,USA,<ENT1> is the notable work of <ENT0> .,<ENT0> was created in <ENT1> .,<ENT0> is <ENT1> citizen .,[MASK] is the notable work of Kaye Gibbons .,Ellen Foster was created in [MASK] .,Kaye Gibbons is [MASK] citizen .,"('P800', 'P495', 'P27')"
Q40554,P31,Q187659,P527,Q48332,P361,Ku (kana),kana,hiragana,<ENT0> is a <ENT1> .,<ENT0> consists of <ENT1> .,<ENT0> is part of <ENT1> .,Ku (kana) is a [MASK] .,kana consists of [MASK] .,Ku (kana) is part of [MASK] .,"('P31', 'P527', 'P361')"
Q6724292,P138,Q706561,P20,Q570509,P131,Mackay Memorial Hospital,George Leslie Mackay,Tamsui,<ENT0> is named after <ENT1> .,<ENT0> died in <ENT1> .,<ENT0> is located in <ENT1> .,Mackay Memorial Hospital is named after [MASK] .,George Leslie Mackay died in [MASK] .,Mackay Memorial Hospital is located in [MASK] .,"('P138', 'P20', 'P131')"
Q172822,P131,Q816,P206,Q1265,P706,Hoover Dam,Arizona,Colorado,<ENT0> is located in <ENT1> .,<ENT0> is located in or next to <ENT1> .,<ENT0> is located on <ENT1> .,Hoover Dam is located in [MASK] .,Arizona is located in or next to [MASK] .,Hoover Dam is located on [MASK] .,"('P131', 'P206', 'P706')"
Q5242127,P108,Q737835,P159,Q3616,P19,Davoud Hermidas-Bavand,Tehran University,Tehran,<ENT0> works for <ENT1> .,The headquarter of <ENT0> is in <ENT1> .,<ENT0> was born in <ENT1> .,Davoud Hermidas-Bavand works for [MASK] .,The headquarter of Tehran University is in [MASK] .,Davoud Hermidas-Bavand was born in [MASK] .,"('P108', 'P159', 'P19')"
Q1343021,P131,Q3224,P150,Q820286,P1376,"Nowra, New South Wales",NSW,Shoalhaven,<ENT0> is located in <ENT1> .,<ENT0> contains the administrative territorial entity <ENT1> .,<ENT0> is the capital of <ENT1> .,"Nowra, New South Wales is located in [MASK] .",NSW contains the administrative territorial entity [MASK] .,"Nowra, New South Wales is the capital of [MASK] .","('P131', 'P150', 'P1376')"
Q224723,P1346,Q105542,P1344,Q33881,P31,1992 Tour de France,Miguel Indurain,Tour de France,The winner of <ENT0> is <ENT1> .,<ENT0> participated in <ENT1> .,<ENT0> is a <ENT1> .,The winner of 1992 Tour de France is [MASK] .,Miguel Indurain participated in [MASK] .,1992 Tour de France is a [MASK] .,"('P1346', 'P1344', 'P31')"
Q754512,P131,Q1391,P150,Q511135,P1376,"Princess Anne, Maryland",Maryland,"Somerset County, Maryland",<ENT0> is located in <ENT1> .,<ENT0> contains the administrative territorial entity <ENT1> .,<ENT0> is the capital of <ENT1> .,"Princess Anne, Maryland is located in [MASK] .",Maryland contains the administrative territorial entity [MASK] .,"Princess Anne, Maryland is the capital of [MASK] .","('P131', 'P150', 'P1376')"
Q318478,P40,Q434760,P19,Q35,P27,Eric I,Canute Lavard,Danish,<ENT1> is the child of <ENT0> .,<ENT0> was born in <ENT1> .,<ENT0> is <ENT1> citizen .,[MASK] is the child of Eric I .,Canute Lavard was born in [MASK] .,Eric I is [MASK] citizen .,"('P40', 'P19', 'P27')"
Q700534,P150,Q167600,P1376,Q12816,P131,Arrondissement of Auxerre,Auxerre,Yonne,<ENT0> contains the administrative territorial entity <ENT1> .,<ENT0> is the capital of <ENT1> .,<ENT0> is located in <ENT1> .,Arrondissement of Auxerre contains the administrative territorial entity [MASK] .,Auxerre is the capital of [MASK] .,Arrondissement of Auxerre is located in [MASK] .,"('P150', 'P1376', 'P131')"
Q16092053,P69,Q845768,P17,Q30,P27,Joseph Louis Tauro,Cornell Law School,USA,<ENT0> is educated at <ENT1> .,<ENT0> is located in <ENT1> .,<ENT0> is <ENT1> citizen .,Joseph Louis Tauro is educated at [MASK] .,Cornell Law School is located in [MASK] .,Joseph Louis Tauro is [MASK] citizen .,"('P69', 'P17', 'P27')"
Q1937108,P17,Q142,P36,Q90,P131,Tour de Nesle,France,Paris,<ENT0> is located in <ENT1> .,The capital of <ENT0> is <ENT1> .,<ENT0> is located in <ENT1> .,Tour de Nesle is located in [MASK] .,The capital of France is [MASK] .,Tour de Nesle is located in [MASK] .,"('P17', 'P36', 'P131')"
Q5722357,P19,Q1345,P17,Q30,P945,Henry H. Bingham,Philadelphia,USA,<ENT0> was born in <ENT1> .,<ENT0> is located in <ENT1> .,<ENT0> had allegiance to <ENT1> .,Henry H. Bingham was born in [MASK] .,Philadelphia is located in [MASK] .,Henry H. Bingham had allegiance to [MASK] .,"('P19', 'P17', 'P945')"
Q61237,P3373,Q76751,P19,Q1615401,P20,Rudolf Dassler,"Adolf ""Adi"" Dassler",Herzogenaurach,<ENT0> is sibling of <ENT1>.,<ENT0> was born in <ENT1> .,<ENT0> died in <ENT1> .,Rudolf Dassler is sibling of [MASK].,"Adolf ""Adi"" Dassler was born in [MASK] .",Rudolf Dassler died in [MASK] .,"('P3373', 'P19', 'P20')"
Q62633,P36,Q1757,P1376,Q33,P1366,Finland,Helsinki,Finland,The capital of <ENT0> is <ENT1> .,<ENT0> is the capital of <ENT1> .,<ENT0> is replaced by <ENT1> .,The capital of Finland is [MASK] .,Helsinki is the capital of [MASK] .,Finland is replaced by [MASK] .,"('P36', 'P1376', 'P1366')"
Q131706,P119,Q662652,P131,Q1741,P20,Maria Theresa,Imperial Crypt,Vienna,<ENT0> was buried in <ENT1> .,<ENT0> is located in <ENT1> .,<ENT0> died in <ENT1> .,Maria Theresa was buried in [MASK] .,Imperial Crypt is located in [MASK] .,Maria Theresa died in [MASK] .,"('P119', 'P131', 'P20')"
Q34820,P206,Q1634730,P17,Q786,P131,"Santo Domingo, Dominican Republic",Ozama River,Dominican,<ENT0> is located in or next to <ENT1> .,<ENT0> is located in <ENT1> .,<ENT0> is located in <ENT1> .,"Santo Domingo, Dominican Republic is located in or next to [MASK] .",Ozama River is located in [MASK] .,"Santo Domingo, Dominican Republic is located in [MASK] .","('P206', 'P17', 'P131')"
Q15625604,P20,Q385,P17,Q36,P19,Maciej Dunal,Gdynia,Polish,<ENT0> died in <ENT1> .,<ENT0> is located in <ENT1> .,<ENT0> was born in <ENT1> .,Maciej Dunal died in [MASK] .,Gdynia is located in [MASK] .,Maciej Dunal was born in [MASK] .,"('P20', 'P17', 'P19')"
Q5748,P527,Q54889,P47,Q54932,P527,Castile-La Mancha,Albacete,Ciudad Real,<ENT0> consists of <ENT1> .,<ENT0> shares border with <ENT1> .,<ENT0> consists of <ENT1> .,Castile-La Mancha consists of [MASK] .,Albacete shares border with [MASK] .,Castile-La Mancha consists of [MASK] .,"('P527', 'P47', 'P527')"
Q240694,P17,Q869,P150,Q182565,P138,Phuket International Airport,Thailand,Phuket,<ENT0> is located in <ENT1> .,<ENT0> contains the administrative territorial entity <ENT1> .,<ENT0> is named after <ENT1> .,Phuket International Airport is located in [MASK] .,Thailand contains the administrative territorial entity [MASK] .,Phuket International Airport is named after [MASK] .,"('P17', 'P150', 'P138')"
Q6751859,P53,Q31711,P17,Q851,P27,Mansour bin Abdulaziz Al Saud,Saudi Prince,Saudi Arabia,<ENT0> has the family <ENT1> .,<ENT0> is located in <ENT1> .,<ENT0> is <ENT1> citizen .,Mansour bin Abdulaziz Al Saud has the family [MASK] .,Saudi Prince is located in [MASK] .,Mansour bin Abdulaziz Al Saud is [MASK] citizen .,"('P53', 'P17', 'P27')"
Q1198,P527,Q164903,P17,Q183,P131,North Rhine-Westphalia,Rhine-Ruhr,Germany,<ENT0> consists of <ENT1> .,<ENT0> is located in <ENT1> .,<ENT0> is located in <ENT1> .,North Rhine-Westphalia consists of [MASK] .,Rhine-Ruhr is located in [MASK] .,North Rhine-Westphalia is located in [MASK] .,"('P527', 'P17', 'P131')"
Q898557,P40,Q2506976,P19,Q1085,P937,Prince Franz de Paula,Prince Alfred,Prague,<ENT1> is the child of <ENT0> .,<ENT0> was born in <ENT1> .,<ENT0> used to work in <ENT1> .,[MASK] is the child of Prince Franz de Paula .,Prince Alfred was born in [MASK] .,Prince Franz de Paula used to work in [MASK] .,"('P40', 'P19', 'P937')"
Q104042,P31,Q66016,P527,Q104012,P3373,Terpsichore,Muses,Euterpe,<ENT0> is a <ENT1> .,<ENT0> consists of <ENT1> .,<ENT0> is sibling of <ENT1>.,Terpsichore is a [MASK] .,Muses consists of [MASK] .,Terpsichore is sibling of [MASK].,"('P31', 'P527', 'P3373')"
Q9458,P40,Q784324,P25,Q42034,P26,Muhammad,Qasim ibn Muhammad,Khadijah bint Khuwaylid,<ENT1> is the child of <ENT0> .,<ENT1> is the mother of <ENT0> .,<ENT0> is spouse of <ENT1>.,[MASK] is the child of Muhammad .,[MASK] is the mother of Qasim ibn Muhammad .,Muhammad is spouse of [MASK].,"('P40', 'P25', 'P26')"
Q427658,P131,Q168811,P1366,Q232,P131,Atyrau Region,Kazakh SSR,Kazakhstan,<ENT0> is located in <ENT1> .,<ENT0> is replaced by <ENT1> .,<ENT0> is located in <ENT1> .,Atyrau Region is located in [MASK] .,Kazakh SSR is replaced by [MASK] .,Atyrau Region is located in [MASK] .,"('P131', 'P1366', 'P131')"
Q17017,P131,Q64,P17,Q183,P127,A 111,Berlin,Germany,<ENT0> is located in <ENT1> .,<ENT0> is located in <ENT1> .,<ENT0> is owned by <ENT1> .,A 111 is located in [MASK] .,Berlin is located in [MASK] .,A 111 is owned by [MASK] .,"('P131', 'P17', 'P127')"
Q136113,P178,Q14647,P127,Q19900,P178,ZFS,Sun Microsystems,Oracle Corporation,<ENT0> is developed by <ENT1> .,<ENT0> is owned by <ENT1> .,<ENT0> is developed by <ENT1> .,ZFS is developed by [MASK] .,Sun Microsystems is owned by [MASK] .,ZFS is developed by [MASK] .,"('P178', 'P127', 'P178')"
Q7317,P800,Q172324,P407,Q652,P1412,Verdi,Otello,Italian,<ENT1> is the notable work of <ENT0> .,<ENT0> was written in <ENT1> .,<ENT0> translating pled spoken callback fluent <ENT1> .,[MASK] is the notable work of Verdi .,Otello was written in [MASK] .,Verdi translating pled spoken callback fluent [MASK] .,"('P800', 'P407', 'P1412')"
Q3269536,P102,Q216082,P1001,Q408,P27,Lynn Arnold,Australian Labor Party,Australia,<ENT0> is member of political party <ENT1> .,<ENT0> is a legal term in <ENT1> .,<ENT0> is <ENT1> citizen .,Lynn Arnold is member of political party [MASK] .,Australian Labor Party is a legal term in [MASK] .,Lynn Arnold is [MASK] citizen .,"('P102', 'P1001', 'P27')"
Q4033819,P176,Q690079,P156,Q80978,P176,AlphaStation,DEC,HP,<ENT0> is produced by <ENT1> .,<ENT0> is followed by <ENT1> .,<ENT0> is produced by <ENT1> .,AlphaStation is produced by [MASK] .,DEC is followed by [MASK] .,AlphaStation is produced by [MASK] .,"('P176', 'P156', 'P176')"
Q186525,P102,Q652091,P155,Q2143929,P102,Julius Nyerere,Chama Cha Mapinduzi,Tanganyika African National Union,<ENT0> is member of political party <ENT1> .,<ENT0> follows <ENT1> .,<ENT0> is member of political party <ENT1> .,Julius Nyerere is member of political party [MASK] .,Chama Cha Mapinduzi follows [MASK] .,Julius Nyerere is member of political party [MASK] .,"('P102', 'P155', 'P102')"
Q311238,P25,Q117012,P26,Q1203,P22,Sean Lennon,Ono,John Lennon,<ENT1> is the mother of <ENT0> .,<ENT0> is spouse of <ENT1>.,<ENT1> is the father of <ENT0> .,[MASK] is the mother of Sean Lennon .,Ono is spouse of [MASK].,[MASK] is the father of Sean Lennon .,"('P25', 'P26', 'P22')"
Q806590,P136,Q828322,P279,Q7889,P31,Banjo-Kazooie: Grunty's Revenge,platform video game,video game,<ENT0> plays <ENT1> music .,<ENT0> is a subclass of <ENT1> .,<ENT0> is a <ENT1> .,Banjo-Kazooie: Grunty's Revenge plays [MASK] music .,platform video game is a subclass of [MASK] .,Banjo-Kazooie: Grunty's Revenge is a [MASK] .,"('P136', 'P279', 'P31')"
Q845402,P19,Q1490,P131,Q17,P27,Natsumi Yanase,Tokyo,Japan,<ENT0> was born in <ENT1> .,<ENT0> is located in <ENT1> .,<ENT0> is <ENT1> citizen .,Natsumi Yanase was born in [MASK] .,Tokyo is located in [MASK] .,Natsumi Yanase is [MASK] citizen .,"('P19', 'P131', 'P27')"
Q963606,P69,Q392904,P159,Q490,P20,Mario Palanti,Politecnico di Milano,Milan,<ENT0> is educated at <ENT1> .,The headquarter of <ENT0> is in <ENT1> .,<ENT0> died in <ENT1> .,Mario Palanti is educated at [MASK] .,The headquarter of Politecnico di Milano is in [MASK] .,Mario Palanti died in [MASK] .,"('P69', 'P159', 'P20')"
Q258965,P27,Q28,P150,Q1781,P551,Petra Mandula,Hungary,Budapest,<ENT0> is <ENT1> citizen .,<ENT0> contains the administrative territorial entity <ENT1> .,<ENT0> resides in <ENT1> .,Petra Mandula is [MASK] citizen .,Hungary contains the administrative territorial entity [MASK] .,Petra Mandula resides in [MASK] .,"('P27', 'P150', 'P551')"
Q670958,P17,Q39,P150,Q12172,P1001,Grand Council of Basel-Stadt,Switzerland,Basel Stadt,<ENT0> is located in <ENT1> .,<ENT0> contains the administrative territorial entity <ENT1> .,<ENT0> is a legal term in <ENT1> .,Grand Council of Basel-Stadt is located in [MASK] .,Switzerland contains the administrative territorial entity [MASK] .,Grand Council of Basel-Stadt is a legal term in [MASK] .,"('P17', 'P150', 'P1001')"
Q37030,P108,Q697730,P159,Q1726,P937,Thomas Mann,Simplicissimus,Munich,<ENT0> works for <ENT1> .,The headquarter of <ENT0> is in <ENT1> .,<ENT0> used to work in <ENT1> .,Thomas Mann works for [MASK] .,The headquarter of Simplicissimus is in [MASK] .,Thomas Mann used to work in [MASK] .,"('P108', 'P159', 'P937')"
Q90,P47,Q241021,P17,Q142,P1376,Paris,Montrouge,France,<ENT0> shares border with <ENT1> .,<ENT0> is located in <ENT1> .,<ENT0> is the capital of <ENT1> .,Paris shares border with [MASK] .,Montrouge is located in [MASK] .,Paris is the capital of [MASK] .,"('P47', 'P17', 'P1376')"
Q240,P36,Q239,P1376,Q31,P17,Brussels,Brussels,Belgium,The capital of <ENT0> is <ENT1> .,<ENT0> is the capital of <ENT1> .,<ENT0> is located in <ENT1> .,The capital of Brussels is [MASK] .,Brussels is the capital of [MASK] .,Brussels is located in [MASK] .,"('P36', 'P1376', 'P17')"
Q38,P463,Q41550,P17,Q142,P530,Italy,OECD,France,<ENT0> is a member of <ENT1> .,<ENT0> is located in <ENT1> .,<ENT0> maintains diplomatic relations with <ENT1> .,Italy is a member of [MASK] .,OECD is located in [MASK] .,Italy maintains diplomatic relations with [MASK] .,"('P463', 'P17', 'P530')"
Q4293730,P27,Q403,P131,Q83286,P27,Borislav Milošević,Serbia,Yugoslav,<ENT0> is <ENT1> citizen .,<ENT0> is located in <ENT1> .,<ENT0> is <ENT1> citizen .,Borislav Milošević is [MASK] citizen .,Serbia is located in [MASK] .,Borislav Milošević is [MASK] citizen .,"('P27', 'P131', 'P27')"
Q779682,P19,Q833271,P131,Q1449,P20,Ausonio Franchi,Pegli,Genoa,<ENT0> was born in <ENT1> .,<ENT0> is located in <ENT1> .,<ENT0> died in <ENT1> .,Ausonio Franchi was born in [MASK] .,Pegli is located in [MASK] .,Ausonio Franchi died in [MASK] .,"('P19', 'P131', 'P20')"
Q1366010,P20,Q213,P150,Q1085,P19,Jiří Pešek,Czech Republic,Prague,<ENT0> died in <ENT1> .,<ENT0> contains the administrative territorial entity <ENT1> .,<ENT0> was born in <ENT1> .,Jiří Pešek died in [MASK] .,Czech Republic contains the administrative territorial entity [MASK] .,Jiří Pešek was born in [MASK] .,"('P20', 'P150', 'P19')"
Q229151,P27,Q33946,P1366,Q213,P27,Helena Suková,Czechoslovakia,Czech Republic,<ENT0> is <ENT1> citizen .,<ENT0> is replaced by <ENT1> .,<ENT0> is <ENT1> citizen .,Helena Suková is [MASK] citizen .,Czechoslovakia is replaced by [MASK] .,Helena Suková is [MASK] citizen .,"('P27', 'P1366', 'P27')"
Q223416,P17,Q142,P36,Q90,P138,Orly Airport,France,Paris,<ENT0> is located in <ENT1> .,The capital of <ENT0> is <ENT1> .,<ENT0> is named after <ENT1> .,Orly Airport is located in [MASK] .,The capital of France is [MASK] .,Orly Airport is named after [MASK] .,"('P17', 'P36', 'P138')"
Q1394911,P937,Q220,P1376,Q38,P27,Clemente Mastella,"Rome, Italy",Italy,<ENT0> used to work in <ENT1> .,<ENT0> is the capital of <ENT1> .,<ENT0> is <ENT1> citizen .,Clemente Mastella used to work in [MASK] .,"Rome, Italy is the capital of [MASK] .",Clemente Mastella is [MASK] citizen .,"('P937', 'P1376', 'P27')"
Q61421,P22,Q64464,P20,Q64,P937,Adolf Erman,Georg Adolf Erman,Berlin,<ENT1> is the father of <ENT0> .,<ENT0> died in <ENT1> .,<ENT0> used to work in <ENT1> .,[MASK] is the father of Adolf Erman .,Georg Adolf Erman died in [MASK] .,Adolf Erman used to work in [MASK] .,"('P22', 'P20', 'P937')"
Q1218,P1376,Q801,P150,Q192232,P1376,Jerusalem,Israel,Jerusalem District,<ENT0> is the capital of <ENT1> .,<ENT0> contains the administrative territorial entity <ENT1> .,<ENT0> is the capital of <ENT1> .,Jerusalem is the capital of [MASK] .,Israel contains the administrative territorial entity [MASK] .,Jerusalem is the capital of [MASK] .,"('P1376', 'P150', 'P1376')"
Q18152960,P495,Q30,P47,Q16,P495,Odd Squad (TV series),USA,Canada,<ENT0> was created in <ENT1> .,<ENT0> shares border with <ENT1> .,<ENT0> was created in <ENT1> .,Odd Squad (TV series) was created in [MASK] .,USA shares border with [MASK] .,Odd Squad (TV series) was created in [MASK] .,"('P495', 'P47', 'P495')"
Q11133423,P27,Q786,P138,Q34820,P20,Marcos Antonio Cabral,Dominican,"Santo Domingo, Dominican Republic",<ENT0> is <ENT1> citizen .,<ENT0> is named after <ENT1> .,<ENT0> died in <ENT1> .,Marcos Antonio Cabral is [MASK] citizen .,Dominican is named after [MASK] .,Marcos Antonio Cabral died in [MASK] .,"('P27', 'P138', 'P20')"
Q3102149,P102,Q1631384,P17,Q16,P27,Georges-Émile Lapalme,Liberal,Canada,<ENT0> is member of political party <ENT1> .,<ENT0> is located in <ENT1> .,<ENT0> is <ENT1> citizen .,Georges-Émile Lapalme is member of political party [MASK] .,Liberal is located in [MASK] .,Georges-Émile Lapalme is [MASK] citizen .,"('P102', 'P17', 'P27')"
Q16286,P36,Q8621,P47,Q10895,P150,Terni,Terni,San Gemini,The capital of <ENT0> is <ENT1> .,<ENT0> shares border with <ENT1> .,<ENT0> contains the administrative territorial entity <ENT1> .,The capital of Terni is [MASK] .,Terni shares border with [MASK] .,Terni contains the administrative territorial entity [MASK] .,"('P36', 'P47', 'P150')"
Q827038,P31,Q380093,P279,Q383092,P31,Academy of Media Arts Cologne,film school,art school,<ENT0> is a <ENT1> .,<ENT0> is a subclass of <ENT1> .,<ENT0> is a <ENT1> .,Academy of Media Arts Cologne is a [MASK] .,film school is a subclass of [MASK] .,Academy of Media Arts Cologne is a [MASK] .,"('P31', 'P279', 'P31')"
Q349777,P26,Q531128,P19,Q30,P27,Hochschild,Arlie Hochschild,USA,<ENT0> is spouse of <ENT1>.,<ENT0> was born in <ENT1> .,<ENT0> is <ENT1> citizen .,Hochschild is spouse of [MASK].,Arlie Hochschild was born in [MASK] .,Hochschild is [MASK] citizen .,"('P26', 'P19', 'P27')"
Q6683,P710,Q30,P47,Q96,P710,Mexican–American War,USA,Mexican,<ENT1> is a participant of <ENT0> .,<ENT0> shares border with <ENT1> .,<ENT1> is a participant of <ENT0> .,[MASK] is a participant of Mexican–American War .,USA shares border with [MASK] .,[MASK] is a participant of Mexican–American War .,"('P710', 'P47', 'P710')"
Q83222,P361,Q101313,P527,Q75507,P155,Mesozoic,Phanerozoic,Paleozoic,<ENT0> is part of <ENT1> .,<ENT0> consists of <ENT1> .,<ENT0> follows <ENT1> .,Mesozoic is part of [MASK] .,Phanerozoic consists of [MASK] .,Mesozoic follows [MASK] .,"('P361', 'P527', 'P155')"
Q3616,P17,Q794,P361,Q48,P30,Tehran,Iran,Asia,<ENT0> is located in <ENT1> .,<ENT0> is part of <ENT1> .,<ENT0> is located in <ENT1> .,Tehran is located in [MASK] .,Iran is part of [MASK] .,Tehran is located in [MASK] .,"('P17', 'P361', 'P30')"
Q23347,P102,Q216082,P1001,Q408,P27,Chris Watson,Australian Labor Party,Australia,<ENT0> is member of political party <ENT1> .,<ENT0> is a legal term in <ENT1> .,<ENT0> is <ENT1> citizen .,Chris Watson is member of political party [MASK] .,Australian Labor Party is a legal term in [MASK] .,Chris Watson is [MASK] citizen .,"('P102', 'P1001', 'P27')"
Q44111,P27,Q30,P530,Q801,P27,Dan Shechtman,USA,Israel,<ENT0> is <ENT1> citizen .,<ENT0> maintains diplomatic relations with <ENT1> .,<ENT0> is <ENT1> citizen .,Dan Shechtman is [MASK] citizen .,USA maintains diplomatic relations with [MASK] .,Dan Shechtman is [MASK] citizen .,"('P27', 'P530', 'P27')"
Q958494,P20,Q1757,P37,Q1412,P1412,Reino Helismaa,Helsinki,Finnish,<ENT0> died in <ENT1> .,The official language of <ENT0> is <ENT1> .,<ENT0> translating pled spoken callback fluent <ENT1> .,Reino Helismaa died in [MASK] .,The official language of Helsinki is [MASK] .,Reino Helismaa translating pled spoken callback fluent [MASK] .,"('P20', 'P37', 'P1412')"
Q34417,P40,Q34464,P3373,Q158256,P40,Philip II,Philip III,Isabella,<ENT1> is the child of <ENT0> .,<ENT0> is sibling of <ENT1>.,<ENT1> is the child of <ENT0> .,[MASK] is the child of Philip II .,Philip III is sibling of [MASK].,[MASK] is the child of Philip II .,"('P40', 'P3373', 'P40')"
Q491879,P1376,Q487537,P131,Q265,P17,Termez,Surxondaryo Region,Uzbekistan,<ENT0> is the capital of <ENT1> .,<ENT0> is located in <ENT1> .,<ENT0> is located in <ENT1> .,Termez is the capital of [MASK] .,Surxondaryo Region is located in [MASK] .,Termez is located in [MASK] .,"('P1376', 'P131', 'P17')"
Q850,P178,Q1000428,P127,Q19900,P178,MySQL,MySQL AB,Oracle Corporation,<ENT0> is developed by <ENT1> .,<ENT0> is owned by <ENT1> .,<ENT0> is developed by <ENT1> .,MySQL is developed by [MASK] .,MySQL AB is owned by [MASK] .,MySQL is developed by [MASK] .,"('P178', 'P127', 'P178')"
Q2062078,P159,Q727,P17,Q55,P495,UNStudio,Amsterdam,Netherlands,The headquarter of <ENT0> is in <ENT1> .,<ENT0> is located in <ENT1> .,<ENT0> was created in <ENT1> .,The headquarter of UNStudio is in [MASK] .,Amsterdam is located in [MASK] .,UNStudio was created in [MASK] .,"('P159', 'P17', 'P495')"
Q3067117,P264,Q778673,P159,Q5083,P740,Fastbacks,Sub Pop,"Seattle, Washington",<ENT0> is represented by music label <ENT1> .,The headquarter of <ENT0> is in <ENT1> .,<ENT0> was founded in <ENT1> .,Fastbacks is represented by music label [MASK] .,The headquarter of Sub Pop is in [MASK] .,Fastbacks was founded in [MASK] .,"('P264', 'P159', 'P740')"
