subject_id,predicate_id_1,object_id_1,predicate_id_2,object_id_2,predicate_id_3,subject,object_1,object_2,init_prompt_1,init_prompt_2,init_prompt_3,prompt_1,prompt_2,prompt_3,key
Q16056757,P607,Q361,P710,Q30,P17,148th Aero Squadron,First World War,USA,<ENT0> participated in the conflict of <ENT1> .,<ENT1> is a participant of <ENT0> .,<ENT0> is located in <ENT1> .,148th Aero Squadron participated in the conflict of [MASK] .,[MASK] is a participant of First World War .,148th Aero Squadron is located in [MASK] .,"('P607', 'P710', 'P17')"
Q489163,P138,Q366113,P27,Q30,P17,"Green County, Wisconsin",Nathanael Greene,USA,<ENT0> is named after <ENT1> .,<ENT0> is <ENT1> citizen .,<ENT0> is located in <ENT1> .,"Green County, Wisconsin is named after [MASK] .",Nathanael Greene is [MASK] citizen .,"Green County, Wisconsin is located in [MASK] .","('P138', 'P27', 'P17')"
Q641784,P131,Q585,P1376,Q20,P17,SK Vidar,Oslo,Norway,<ENT0> is located in <ENT1> .,<ENT0> is the capital of <ENT1> .,<ENT0> is located in <ENT1> .,SK Vidar is located in [MASK] .,Oslo is the capital of [MASK] .,SK Vidar is located in [MASK] .,"('P131', 'P1376', 'P17')"
Q1782980,P17,Q1033,P150,Q815913,P138,Unilag,Nigeria,Lagos State,<ENT0> is located in <ENT1> .,<ENT0> contains the administrative territorial entity <ENT1> .,<ENT0> is named after <ENT1> .,Unilag is located in [MASK] .,Nigeria contains the administrative territorial entity [MASK] .,Unilag is named after [MASK] .,"('P17', 'P150', 'P138')"
Q94789,P17,Q17,P150,Q123376,P131,"Hōjō, Ehime",Japan,Ehime prefecture,<ENT0> is located in <ENT1> .,<ENT0> contains the administrative territorial entity <ENT1> .,<ENT0> is located in <ENT1> .,"Hōjō, Ehime is located in [MASK] .",Japan contains the administrative territorial entity [MASK] .,"Hōjō, Ehime is located in [MASK] .","('P17', 'P150', 'P131')"
Q400837,P102,Q940293,P159,Q796,P27,Ahmed Chalabi,Iraqi National Congress,Iraq,<ENT0> is member of political party <ENT1> .,The headquarter of <ENT0> is in <ENT1> .,<ENT0> is <ENT1> citizen .,Ahmed Chalabi is member of political party [MASK] .,The headquarter of Iraqi National Congress is in [MASK] .,Ahmed Chalabi is [MASK] citizen .,"('P102', 'P159', 'P27')"
Q160149,P800,Q2956755,P17,Q30,P27,Mark Rothko,Rothko Chapel,USA,<ENT1> is the notable work of <ENT0> .,<ENT0> is located in <ENT1> .,<ENT0> is <ENT1> citizen .,[MASK] is the notable work of Mark Rothko .,Rothko Chapel is located in [MASK] .,Mark Rothko is [MASK] citizen .,"('P800', 'P17', 'P27')"
Q245624,P1066,Q453485,P19,Q90,P20,Merry-Joseph Blondel,Jean-Baptiste Regnault,Paris,<ENT0> is the student of <ENT1> .,<ENT0> was born in <ENT1> .,<ENT0> died in <ENT1> .,Merry-Joseph Blondel is the student of [MASK] .,Jean-Baptiste Regnault was born in [MASK] .,Merry-Joseph Blondel died in [MASK] .,"('P1066', 'P19', 'P20')"
Q7456922,P131,Q1400,P150,Q1345,P159,Settlement Music School,Pennsylvania,Philadelphia,<ENT0> is located in <ENT1> .,<ENT0> contains the administrative territorial entity <ENT1> .,The headquarter of <ENT0> is in <ENT1> .,Settlement Music School is located in [MASK] .,Pennsylvania contains the administrative territorial entity [MASK] .,The headquarter of Settlement Music School is in [MASK] .,"('P131', 'P150', 'P159')"
Q1562089,P551,Q1348,P17,Q668,P27,Jaidip Mukerjea,Calcutta,India,<ENT0> resides in <ENT1> .,<ENT0> is located in <ENT1> .,<ENT0> is <ENT1> citizen .,Jaidip Mukerjea resides in [MASK] .,Calcutta is located in [MASK] .,Jaidip Mukerjea is [MASK] citizen .,"('P551', 'P17', 'P27')"
Q7287809,P19,Q990957,P131,Q100,P20,Ralph Lowell,"Chestnut Hill, Massachusetts","Boston, Massachusetts",<ENT0> was born in <ENT1> .,<ENT0> is located in <ENT1> .,<ENT0> died in <ENT1> .,Ralph Lowell was born in [MASK] .,"Chestnut Hill, Massachusetts is located in [MASK] .",Ralph Lowell died in [MASK] .,"('P19', 'P131', 'P20')"
Q1178686,P27,Q28,P150,Q1781,P19,József Molnár (writer),Hungary,Budapest,<ENT0> is <ENT1> citizen .,<ENT0> contains the administrative territorial entity <ENT1> .,<ENT0> was born in <ENT1> .,József Molnár (writer) is [MASK] citizen .,Hungary contains the administrative territorial entity [MASK] .,József Molnár (writer) was born in [MASK] .,"('P27', 'P150', 'P19')"
Q7084198,P131,Q1509,P36,Q23197,P131,"Old Hickory, Tennessee",Tennessee,downtown Nashville,<ENT0> is located in <ENT1> .,The capital of <ENT0> is <ENT1> .,<ENT0> is located in <ENT1> .,"Old Hickory, Tennessee is located in [MASK] .",The capital of Tennessee is [MASK] .,"Old Hickory, Tennessee is located in [MASK] .","('P131', 'P36', 'P131')"
Q619364,P159,Q249994,P17,Q865,P740,Realtek Semiconductor,Hsinchu,Taiwan,The headquarter of <ENT0> is in <ENT1> .,<ENT0> is located in <ENT1> .,<ENT0> was founded in <ENT1> .,The headquarter of Realtek Semiconductor is in [MASK] .,Hsinchu is located in [MASK] .,Realtek Semiconductor was founded in [MASK] .,"('P159', 'P17', 'P740')"
Q6059,P17,Q224,P206,Q13924,P706,Krk,Croatia,Adriatic Sea,<ENT0> is located in <ENT1> .,<ENT0> is located in or next to <ENT1> .,<ENT0> is located on <ENT1> .,Krk is located in [MASK] .,Croatia is located in or next to [MASK] .,Krk is located on [MASK] .,"('P17', 'P206', 'P706')"
Q219,P37,Q7918,P17,Q403,P47,Bulgaria,Bulgarian,Serbia,The official language of <ENT0> is <ENT1> .,<ENT0> is located in <ENT1> .,<ENT0> shares border with <ENT1> .,The official language of Bulgaria is [MASK] .,Bulgarian is located in [MASK] .,Bulgaria shares border with [MASK] .,"('P37', 'P17', 'P47')"
Q7768,P112,Q252,P47,Q334,P112,ASEAN,Indonesia,Singapore,<ENT0> is founded by <ENT1> .,<ENT0> shares border with <ENT1> .,<ENT0> is founded by <ENT1> .,ASEAN is founded by [MASK] .,Indonesia shares border with [MASK] .,ASEAN is founded by [MASK] .,"('P112', 'P47', 'P112')"
Q76555,P155,Q151075,P40,Q236907,P3373,"Joseph II, Holy Roman Emperor","Francis I, Holy Roman Emperor",Maria Amalia,<ENT0> follows <ENT1> .,<ENT1> is the child of <ENT0> .,<ENT0> is sibling of <ENT1>.,"Joseph II, Holy Roman Emperor follows [MASK] .","[MASK] is the child of Francis I, Holy Roman Emperor .","Joseph II, Holy Roman Emperor is sibling of [MASK].","('P155', 'P40', 'P3373')"
Q235462,P3373,Q236293,P937,Q142,P19,Alys,Marie de Champagne,France,<ENT0> is sibling of <ENT1>.,<ENT0> used to work in <ENT1> .,<ENT0> was born in <ENT1> .,Alys is sibling of [MASK].,Marie de Champagne used to work in [MASK] .,Alys was born in [MASK] .,"('P3373', 'P937', 'P19')"
Q1160868,P112,Q919992,P27,Q30,P159,Revolution Studios,Joe Roth,USA,<ENT0> is founded by <ENT1> .,<ENT0> is <ENT1> citizen .,The headquarter of <ENT0> is in <ENT1> .,Revolution Studios is founded by [MASK] .,Joe Roth is [MASK] citizen .,The headquarter of Revolution Studios is in [MASK] .,"('P112', 'P27', 'P159')"
Q2677944,P131,Q133356,P361,Q15180,P17,Crimean Oblast,Ukrainian,Soviet,<ENT0> is located in <ENT1> .,<ENT0> is part of <ENT1> .,<ENT0> is located in <ENT1> .,Crimean Oblast is located in [MASK] .,Ukrainian is part of [MASK] .,Crimean Oblast is located in [MASK] .,"('P131', 'P361', 'P17')"
Q3773422,P22,Q80518,P19,Q433032,P20,Aun,Jorund,Uppsala,<ENT1> is the father of <ENT0> .,<ENT0> was born in <ENT1> .,<ENT0> died in <ENT1> .,[MASK] is the father of Aun .,Jorund was born in [MASK] .,Aun died in [MASK] .,"('P22', 'P19', 'P20')"
Q943948,P706,Q8828,P361,Q5765,P131,Santa Maria del Camí,Mallorca,Balearic Islands,<ENT0> is located on <ENT1> .,<ENT0> is part of <ENT1> .,<ENT0> is located in <ENT1> .,Santa Maria del Camí is located on [MASK] .,Mallorca is part of [MASK] .,Santa Maria del Camí is located in [MASK] .,"('P706', 'P361', 'P131')"
Q130800,P706,Q42000,P131,Q30971,P1376,Papeete,Tahiti,French Polynesia,<ENT0> is located on <ENT1> .,<ENT0> is located in <ENT1> .,<ENT0> is the capital of <ENT1> .,Papeete is located on [MASK] .,Tahiti is located in [MASK] .,Papeete is the capital of [MASK] .,"('P706', 'P131', 'P1376')"
Q4897444,P527,Q184816,P156,Q182771,P527,The Sims,The Sims Makin' Magic,The Sims 2,<ENT0> consists of <ENT1> .,<ENT0> is followed by <ENT1> .,<ENT0> consists of <ENT1> .,The Sims consists of [MASK] .,The Sims Makin' Magic is followed by [MASK] .,The Sims consists of [MASK] .,"('P527', 'P156', 'P527')"
Q500054,P527,Q375180,P156,Q791313,P527,Middle Jurassic,Bajocian,Bathonian,<ENT0> consists of <ENT1> .,<ENT0> is followed by <ENT1> .,<ENT0> consists of <ENT1> .,Middle Jurassic consists of [MASK] .,Bajocian is followed by [MASK] .,Middle Jurassic consists of [MASK] .,"('P527', 'P156', 'P527')"
Q1509,P36,Q23197,P17,Q30,P131,Tennessee,downtown Nashville,USA,The capital of <ENT0> is <ENT1> .,<ENT0> is located in <ENT1> .,<ENT0> is located in <ENT1> .,The capital of Tennessee is [MASK] .,downtown Nashville is located in [MASK] .,Tennessee is located in [MASK] .,"('P36', 'P17', 'P131')"
Q2046249,P47,Q2807,P1376,Q29,P17,Paracuellos de Jarama,Madrid,Spain,<ENT0> shares border with <ENT1> .,<ENT0> is the capital of <ENT1> .,<ENT0> is located in <ENT1> .,Paracuellos de Jarama shares border with [MASK] .,Madrid is the capital of [MASK] .,Paracuellos de Jarama is located in [MASK] .,"('P47', 'P1376', 'P17')"
Q12454032,P156,Q239505,P25,Q6192525,P26,Shahaji,Shivaji,Jijabai,<ENT0> is followed by <ENT1> .,<ENT1> is the mother of <ENT0> .,<ENT0> is spouse of <ENT1>.,Shahaji is followed by [MASK] .,[MASK] is the mother of Shivaji .,Shahaji is spouse of [MASK].,"('P156', 'P25', 'P26')"
Q855478,P131,Q132936,P138,Q200078,P131,"Kita-ku, Okayama",Okayama Prefecture,Okayama,<ENT0> is located in <ENT1> .,<ENT0> is named after <ENT1> .,<ENT0> is located in <ENT1> .,"Kita-ku, Okayama is located in [MASK] .",Okayama Prefecture is named after [MASK] .,"Kita-ku, Okayama is located in [MASK] .","('P131', 'P138', 'P131')"
Q3567122,P706,Q14112,P131,Q142,P17,Tour du Sel,Corsica,France,<ENT0> is located on <ENT1> .,<ENT0> is located in <ENT1> .,<ENT0> is located in <ENT1> .,Tour du Sel is located on [MASK] .,Corsica is located in [MASK] .,Tour du Sel is located in [MASK] .,"('P706', 'P131', 'P17')"
Q27449,P527,Q222,P30,Q46,P361,Southern Europe,Albania,Europe,<ENT0> consists of <ENT1> .,<ENT0> is located in <ENT1> .,<ENT0> is part of <ENT1> .,Southern Europe consists of [MASK] .,Albania is located in [MASK] .,Southern Europe is part of [MASK] .,"('P527', 'P30', 'P361')"
Q202291,P361,Q1421206,P279,Q41466,P641,2009–10 GET-ligaen season,UPC-ligaen,ice hockey,<ENT0> is part of <ENT1> .,<ENT0> is a subclass of <ENT1> .,<ENT0> plays the sport <ENT1> .,2009–10 GET-ligaen season is part of [MASK] .,UPC-ligaen is a subclass of [MASK] .,2009–10 GET-ligaen season plays the sport [MASK] .,"('P361', 'P279', 'P641')"
Q458,P37,Q9129,P17,Q38,P150,EU,Greek,Italy,The official language of <ENT0> is <ENT1> .,<ENT0> is located in <ENT1> .,<ENT0> contains the administrative territorial entity <ENT1> .,The official language of EU is [MASK] .,Greek is located in [MASK] .,EU contains the administrative territorial entity [MASK] .,"('P37', 'P17', 'P150')"
Q1127061,P127,Q936187,P159,Q846589,P131,Hibernians Ground,Hibernians,"Paola, Malta",<ENT0> is owned by <ENT1> .,The headquarter of <ENT0> is in <ENT1> .,<ENT0> is located in <ENT1> .,Hibernians Ground is owned by [MASK] .,The headquarter of Hibernians is in [MASK] .,Hibernians Ground is located in [MASK] .,"('P127', 'P159', 'P131')"
Q234861,P264,Q183387,P159,Q60,P19,Laura Nyro,Columbia Records,New York City,<ENT0> is represented by music label <ENT1> .,The headquarter of <ENT0> is in <ENT1> .,<ENT0> was born in <ENT1> .,Laura Nyro is represented by music label [MASK] .,The headquarter of Columbia Records is in [MASK] .,Laura Nyro was born in [MASK] .,"('P264', 'P159', 'P19')"
Q1159314,P2632,Q131354,P17,Q30,P27,Henri Young,Alcatraz,USA,<ENT0> was detained at <ENT1> .,<ENT0> is located in <ENT1> .,<ENT0> is <ENT1> citizen .,Henri Young was detained at [MASK] .,Alcatraz is located in [MASK] .,Henri Young is [MASK] citizen .,"('P2632', 'P17', 'P27')"
Q211373,P155,Q188845,P166,Q102427,P1411,Driving Miss Daisy,Rain Man,Best Picture,<ENT0> follows <ENT1> .,<ENT0> was awarded <ENT1> .,<ENT0> was nominated for <ENT1> .,Driving Miss Daisy follows [MASK] .,Rain Man was awarded [MASK] .,Driving Miss Daisy was nominated for [MASK] .,"('P155', 'P166', 'P1411')"
Q270,P150,Q1017790,P17,Q36,P1376,Warsaw,Ochota,Polish,<ENT0> contains the administrative territorial entity <ENT1> .,<ENT0> is located in <ENT1> .,<ENT0> is the capital of <ENT1> .,Warsaw contains the administrative territorial entity [MASK] .,Ochota is located in [MASK] .,Warsaw is the capital of [MASK] .,"('P150', 'P17', 'P1376')"
Q6226777,P127,Q7346,P27,Q30,P17,John Coltrane House,John Coltrane,USA,<ENT0> is owned by <ENT1> .,<ENT0> is <ENT1> citizen .,<ENT0> is located in <ENT1> .,John Coltrane House is owned by [MASK] .,John Coltrane is [MASK] citizen .,John Coltrane House is located in [MASK] .,"('P127', 'P27', 'P17')"
Q102139,P40,Q159101,P19,Q1748,P551,Queen Margrethe II,Prince Joachim,Copenhagen,<ENT1> is the child of <ENT0> .,<ENT0> was born in <ENT1> .,<ENT0> resides in <ENT1> .,[MASK] is the child of Queen Margrethe II .,Prince Joachim was born in [MASK] .,Queen Margrethe II resides in [MASK] .,"('P40', 'P19', 'P551')"
Q93362,P25,Q131706,P20,Q1741,P19,Maximilian Franz,Maria Theresa,Vienna,<ENT1> is the mother of <ENT0> .,<ENT0> died in <ENT1> .,<ENT0> was born in <ENT1> .,[MASK] is the mother of Maximilian Franz .,Maria Theresa died in [MASK] .,Maximilian Franz was born in [MASK] .,"('P25', 'P20', 'P19')"
Q84,P1376,Q161885,P1366,Q174193,P1376,London,Great Britain,United Kingdom,<ENT0> is the capital of <ENT1> .,<ENT0> is replaced by <ENT1> .,<ENT0> is the capital of <ENT1> .,London is the capital of [MASK] .,Great Britain is replaced by [MASK] .,London is the capital of [MASK] .,"('P1376', 'P1366', 'P1376')"
Q180761,P22,Q130221,P451,Q272199,P25,Anna of Hohenstaufen,"Frederick II, Holy Roman Emperor",Bianca Lancia,<ENT1> is the father of <ENT0> .,<ENT0> is the unmarried partner of <ENT1>.,<ENT1> is the mother of <ENT0> .,[MASK] is the father of Anna of Hohenstaufen .,"Frederick II, Holy Roman Emperor is the unmarried partner of [MASK].",[MASK] is the mother of Anna of Hohenstaufen .,"('P22', 'P451', 'P25')"
Q363296,P1038,Q729041,P20,Q2044,P19,Agnolo Gaddi,Gaddo Gaddi,Florentine,<ENT0> is related to <ENT1>.,<ENT0> died in <ENT1> .,<ENT0> was born in <ENT1> .,Agnolo Gaddi is related to [MASK].,Gaddo Gaddi died in [MASK] .,Agnolo Gaddi was born in [MASK] .,"('P1038', 'P20', 'P19')"
Q4701994,P551,Q216,P1376,Q37,P27,Akvilė Paražinskaitė,Wilna,Lithuania,<ENT0> resides in <ENT1> .,<ENT0> is the capital of <ENT1> .,<ENT0> is <ENT1> citizen .,Akvilė Paražinskaitė resides in [MASK] .,Wilna is the capital of [MASK] .,Akvilė Paražinskaitė is [MASK] citizen .,"('P551', 'P1376', 'P27')"
Q53437,P40,Q53438,P20,Q1731,P19,Augustus II,Augustus III,Dresden,<ENT1> is the child of <ENT0> .,<ENT0> died in <ENT1> .,<ENT0> was born in <ENT1> .,[MASK] is the child of Augustus II .,Augustus III died in [MASK] .,Augustus II was born in [MASK] .,"('P40', 'P20', 'P19')"
Q1724408,P131,Q3334,P150,Q134698,P36,Canton of Bastia-6,Haute-Corse,Bastia,<ENT0> is located in <ENT1> .,<ENT0> contains the administrative territorial entity <ENT1> .,The capital of <ENT0> is <ENT1> .,Canton of Bastia-6 is located in [MASK] .,Haute-Corse contains the administrative territorial entity [MASK] .,The capital of Canton of Bastia-6 is [MASK] .,"('P131', 'P150', 'P36')"
Q155985,P551,Q1400,P131,Q30,P27,Santorum,Pennsylvania,USA,<ENT0> resides in <ENT1> .,<ENT0> is located in <ENT1> .,<ENT0> is <ENT1> citizen .,Santorum resides in [MASK] .,Pennsylvania is located in [MASK] .,Santorum is [MASK] citizen .,"('P551', 'P131', 'P27')"
Q151667,P40,Q159585,P20,Q472,P937,Ferdinand I,Crown Prince Boris,Sofia,<ENT1> is the child of <ENT0> .,<ENT0> died in <ENT1> .,<ENT0> used to work in <ENT1> .,[MASK] is the child of Ferdinand I .,Crown Prince Boris died in [MASK] .,Ferdinand I used to work in [MASK] .,"('P40', 'P20', 'P937')"
Q668,P150,Q1186,P47,Q66743,P150,India,Kerala,Puducherry,<ENT0> contains the administrative territorial entity <ENT1> .,<ENT0> shares border with <ENT1> .,<ENT0> contains the administrative territorial entity <ENT1> .,India contains the administrative territorial entity [MASK] .,Kerala shares border with [MASK] .,India contains the administrative territorial entity [MASK] .,"('P150', 'P47', 'P150')"
Q1501628,P17,Q41,P1589,Q4918,P706,Strongyli,Greek islands,Mediterranean Sea,<ENT0> is located in <ENT1> .,<ENT1> is the lowest point of <ENT0> region .,<ENT0> is located on <ENT1> .,Strongyli is located in [MASK] .,[MASK] is the lowest point of Greek islands region .,Strongyli is located on [MASK] .,"('P17', 'P1589', 'P706')"
Q207424,P36,Q217071,P1376,Q579906,P150,Ucayali Region,Pucallpa,Coronel Portillo Province,The capital of <ENT0> is <ENT1> .,<ENT0> is the capital of <ENT1> .,<ENT0> contains the administrative territorial entity <ENT1> .,The capital of Ucayali Region is [MASK] .,Pucallpa is the capital of [MASK] .,Ucayali Region contains the administrative territorial entity [MASK] .,"('P36', 'P1376', 'P150')"
Q458,P150,Q218,P530,Q183,P150,EU,Romania,Germany,<ENT0> contains the administrative territorial entity <ENT1> .,<ENT0> maintains diplomatic relations with <ENT1> .,<ENT0> contains the administrative territorial entity <ENT1> .,EU contains the administrative territorial entity [MASK] .,Romania maintains diplomatic relations with [MASK] .,EU contains the administrative territorial entity [MASK] .,"('P150', 'P530', 'P150')"
Q1964761,P20,Q84,P190,Q649,P19,Semyon,London,Moscow,<ENT0> died in <ENT1> .,<ENT0> and <ENT1> are twin cities .,<ENT0> was born in <ENT1> .,Semyon died in [MASK] .,London and [MASK] are twin cities .,Semyon was born in [MASK] .,"('P20', 'P190', 'P19')"
Q1067299,P17,Q16,P37,Q1860,P364,Toronto Star,Canada,English,<ENT0> is located in <ENT1> .,The official language of <ENT0> is <ENT1> .,<ENT0> population language predomin smoker installer <ENT1> .,Toronto Star is located in [MASK] .,The official language of Canada is [MASK] .,Toronto Star population language predomin smoker installer [MASK] .,"('P17', 'P37', 'P364')"
Q757302,P22,Q180916,P26,Q1614785,P25,Trunks,Vegeta,Bulma,<ENT1> is the father of <ENT0> .,<ENT0> is spouse of <ENT1>.,<ENT1> is the mother of <ENT0> .,[MASK] is the father of Trunks .,Vegeta is spouse of [MASK].,[MASK] is the mother of Trunks .,"('P22', 'P26', 'P25')"
Q302400,P463,Q613059,P495,Q30,P27,Aaron Neville,The Neville Brothers,USA,<ENT0> is a member of <ENT1> .,<ENT0> was created in <ENT1> .,<ENT0> is <ENT1> citizen .,Aaron Neville is a member of [MASK] .,The Neville Brothers was created in [MASK] .,Aaron Neville is [MASK] citizen .,"('P463', 'P495', 'P27')"
Q700425,P3373,Q702209,P19,Q14859,P20,"Frederick I, Margrave of Brandenburg-Ansbach",Johann Cicero,Ansbach,<ENT0> is sibling of <ENT1>.,<ENT0> was born in <ENT1> .,<ENT0> died in <ENT1> .,"Frederick I, Margrave of Brandenburg-Ansbach is sibling of [MASK].",Johann Cicero was born in [MASK] .,"Frederick I, Margrave of Brandenburg-Ansbach died in [MASK] .","('P3373', 'P19', 'P20')"
Q8005603,P112,Q8014843,P19,Q1297,P159,William Blair & Company,William McCormick Blair,"Chicago, IL",<ENT0> is founded by <ENT1> .,<ENT0> was born in <ENT1> .,The headquarter of <ENT0> is in <ENT1> .,William Blair & Company is founded by [MASK] .,William McCormick Blair was born in [MASK] .,The headquarter of William Blair & Company is in [MASK] .,"('P112', 'P19', 'P159')"
Q195081,P131,Q19660,P1376,Q218,P17,UNATC,Bucharest,Romania,<ENT0> is located in <ENT1> .,<ENT0> is the capital of <ENT1> .,<ENT0> is located in <ENT1> .,UNATC is located in [MASK] .,Bucharest is the capital of [MASK] .,UNATC is located in [MASK] .,"('P131', 'P1376', 'P17')"
Q312967,P40,Q1432076,P3373,Q7399633,P40,Guru Gobind Singh,Sahibzada Ajit Singh,Sahibzada Zorawar Singh,<ENT1> is the child of <ENT0> .,<ENT0> is sibling of <ENT1>.,<ENT1> is the child of <ENT0> .,[MASK] is the child of Guru Gobind Singh .,Sahibzada Ajit Singh is sibling of [MASK].,[MASK] is the child of Guru Gobind Singh .,"('P40', 'P3373', 'P40')"
Q79854,P112,Q1394,P551,Q649,P159,Communist Party,Lenin,Moscow,<ENT0> is founded by <ENT1> .,<ENT0> resides in <ENT1> .,The headquarter of <ENT0> is in <ENT1> .,Communist Party is founded by [MASK] .,Lenin resides in [MASK] .,The headquarter of Communist Party is in [MASK] .,"('P112', 'P551', 'P159')"
Q6668957,P103,Q9205,P17,Q424,P27,Keo Meas,Khmer,Cambodia,The native language of <ENT0> is <ENT1> .,<ENT0> is located in <ENT1> .,<ENT0> is <ENT1> citizen .,The native language of Keo Meas is [MASK] .,Khmer is located in [MASK] .,Keo Meas is [MASK] citizen .,"('P103', 'P17', 'P27')"
Q270295,P361,Q275639,P527,Q270328,P47,Riomaggiore,Cinque Terre,Vernazza,<ENT0> is part of <ENT1> .,<ENT0> consists of <ENT1> .,<ENT0> shares border with <ENT1> .,Riomaggiore is part of [MASK] .,Cinque Terre consists of [MASK] .,Riomaggiore shares border with [MASK] .,"('P361', 'P527', 'P47')"
Q707440,P1038,Q379471,P22,Q452557,P1038,Stu Hart,Harry Smith,Davey Boy Smith,<ENT0> is related to <ENT1>.,<ENT1> is the father of <ENT0> .,<ENT0> is related to <ENT1>.,Stu Hart is related to [MASK].,[MASK] is the father of Harry Smith .,Stu Hart is related to [MASK].,"('P1038', 'P22', 'P1038')"
Q9584,P17,Q17,P150,Q1490,P740,Honda,Japan,Tokyo,<ENT0> is located in <ENT1> .,<ENT0> contains the administrative territorial entity <ENT1> .,<ENT0> was founded in <ENT1> .,Honda is located in [MASK] .,Japan contains the administrative territorial entity [MASK] .,Honda was founded in [MASK] .,"('P17', 'P150', 'P740')"
Q937,P937,Q64,P190,Q1085,P937,Albert Einstein,Berlin,Prague,<ENT0> used to work in <ENT1> .,<ENT0> and <ENT1> are twin cities .,<ENT0> used to work in <ENT1> .,Albert Einstein used to work in [MASK] .,Berlin and [MASK] are twin cities .,Albert Einstein used to work in [MASK] .,"('P937', 'P190', 'P937')"
Q276707,P276,Q1085,P1376,Q33946,P17,1962 World Figure Skating Championships,Prague,Czechoslovakia,<ENT0> is located in <ENT1> .,<ENT0> is the capital of <ENT1> .,<ENT0> is located in <ENT1> .,1962 World Figure Skating Championships is located in [MASK] .,Prague is the capital of [MASK] .,1962 World Figure Skating Championships is located in [MASK] .,"('P276', 'P1376', 'P17')"
Q1191166,P131,Q677037,P36,Q1361,P159,Hyderabad Central University,Telangana,Hyderabad,<ENT0> is located in <ENT1> .,The capital of <ENT0> is <ENT1> .,The headquarter of <ENT0> is in <ENT1> .,Hyderabad Central University is located in [MASK] .,The capital of Telangana is [MASK] .,The headquarter of Hyderabad Central University is in [MASK] .,"('P131', 'P36', 'P159')"
Q296857,P3373,Q231851,P156,Q887410,P3373,Mausolus,Artemisia,Idrieus,<ENT0> is sibling of <ENT1>.,<ENT0> is followed by <ENT1> .,<ENT0> is sibling of <ENT1>.,Mausolus is sibling of [MASK].,Artemisia is followed by [MASK] .,Mausolus is sibling of [MASK].,"('P3373', 'P156', 'P3373')"
Q12548,P156,Q131964,P47,Q153015,P156,Holy Roman Empire,Austrian Empire,Saxony,<ENT0> is followed by <ENT1> .,<ENT0> shares border with <ENT1> .,<ENT0> is followed by <ENT1> .,Holy Roman Empire is followed by [MASK] .,Austrian Empire shares border with [MASK] .,Holy Roman Empire is followed by [MASK] .,"('P156', 'P47', 'P156')"
Q458,P150,Q38,P530,Q35,P47,EU,Italy,Danish,<ENT0> contains the administrative territorial entity <ENT1> .,<ENT0> maintains diplomatic relations with <ENT1> .,<ENT0> shares border with <ENT1> .,EU contains the administrative territorial entity [MASK] .,Italy maintains diplomatic relations with [MASK] .,EU shares border with [MASK] .,"('P150', 'P530', 'P47')"
Q1132146,P20,Q1489,P1376,Q96,P27,Cordelia Urueta,Mexico City,Mexican,<ENT0> died in <ENT1> .,<ENT0> is the capital of <ENT1> .,<ENT0> is <ENT1> citizen .,Cordelia Urueta died in [MASK] .,Mexico City is the capital of [MASK] .,Cordelia Urueta is [MASK] citizen .,"('P20', 'P1376', 'P27')"
Q7231,P102,Q49768,P17,Q183,P27,Rosa Luxemburg,SPD,Germany,<ENT0> is member of political party <ENT1> .,<ENT0> is located in <ENT1> .,<ENT0> is <ENT1> citizen .,Rosa Luxemburg is member of political party [MASK] .,SPD is located in [MASK] .,Rosa Luxemburg is [MASK] citizen .,"('P102', 'P17', 'P27')"
Q8029987,P641,Q204632,P495,Q27,P17,Wolfe Tones,Gaelic Football,Irish,<ENT0> plays the sport <ENT1> .,<ENT0> was created in <ENT1> .,<ENT0> is located in <ENT1> .,Wolfe Tones plays the sport [MASK] .,Gaelic Football was created in [MASK] .,Wolfe Tones is located in [MASK] .,"('P641', 'P495', 'P17')"
Q76555,P156,Q151321,P20,Q1741,P19,"Joseph II, Holy Roman Emperor","Leopold II, Holy Roman Emperor",Vienna,<ENT0> is followed by <ENT1> .,<ENT0> died in <ENT1> .,<ENT0> was born in <ENT1> .,"Joseph II, Holy Roman Emperor is followed by [MASK] .","Leopold II, Holy Roman Emperor died in [MASK] .","Joseph II, Holy Roman Emperor was born in [MASK] .","('P156', 'P20', 'P19')"
Q458,P47,Q221,P30,Q46,P138,EU,Macedonian,Europe,<ENT0> shares border with <ENT1> .,<ENT0> is located in <ENT1> .,<ENT0> is named after <ENT1> .,EU shares border with [MASK] .,Macedonian is located in [MASK] .,EU is named after [MASK] .,"('P47', 'P30', 'P138')"
Q183,P530,Q403,P463,Q1065,P361,Germany,Serbia,United Nations,<ENT0> maintains diplomatic relations with <ENT1> .,<ENT0> is a member of <ENT1> .,<ENT0> is part of <ENT1> .,Germany maintains diplomatic relations with [MASK] .,Serbia is a member of [MASK] .,Germany is part of [MASK] .,"('P530', 'P463', 'P361')"
Q207847,P25,Q190055,P26,Q8409,P155,Alexander IV,Roxana,Alexander,<ENT1> is the mother of <ENT0> .,<ENT0> is spouse of <ENT1>.,<ENT0> follows <ENT1> .,[MASK] is the mother of Alexander IV .,Roxana is spouse of [MASK].,Alexander IV follows [MASK] .,"('P25', 'P26', 'P155')"
