subject_id,predicate_id_1,object_id_1,predicate_id_2,object_id_2,predicate_id_3,subject,object_1,object_2,init_prompt_1,init_prompt_2,init_prompt_3,prompt_1,prompt_2,prompt_3,key
Q3169827,P463,Q94301,P159,Q1930,P20,Jean-Pierre Wallot,FRSC,Ottawa,<ENT0> is a member of <ENT1> .,The headquarter of <ENT0> is in <ENT1> .,<ENT0> died in <ENT1> .,Jean-Pierre Wallot is a member of [MASK] .,The headquarter of FRSC is in [MASK] .,Jean-Pierre Wallot died in [MASK] .,"('P463', 'P159', 'P20')"
Q13190593,P276,Q205057,P131,Q419,P17,Runkuraqay,Cusco Region,Peru,<ENT0> is located in <ENT1> .,<ENT0> is located in <ENT1> .,<ENT0> is located in <ENT1> .,Runkuraqay is located in [MASK] .,Cusco Region is located in [MASK] .,Runkuraqay is located in [MASK] .,"('P276', 'P131', 'P17')"
Q201492,P112,Q984450,P20,Q340,P159,McGill University,James McGill,"Montreal, Quebec",<ENT0> is founded by <ENT1> .,<ENT0> died in <ENT1> .,The headquarter of <ENT0> is in <ENT1> .,McGill University is founded by [MASK] .,James McGill died in [MASK] .,The headquarter of McGill University is in [MASK] .,"('P112', 'P20', 'P159')"
Q2249338,P27,Q408,P1344,Q362,P607,Clive Caldwell,Australia,World War II,<ENT0> is <ENT1> citizen .,<ENT0> participated in <ENT1> .,<ENT0> participated in the conflict of <ENT1> .,Clive Caldwell is [MASK] citizen .,Australia participated in [MASK] .,Clive Caldwell participated in the conflict of [MASK] .,"('P27', 'P1344', 'P607')"
Q12722,P138,Q584,P131,Q12172,P47,Haut-Rhin,Rhine,Basel Stadt,<ENT0> is named after <ENT1> .,<ENT0> is located in <ENT1> .,<ENT0> shares border with <ENT1> .,Haut-Rhin is named after [MASK] .,Rhine is located in [MASK] .,Haut-Rhin shares border with [MASK] .,"('P138', 'P131', 'P47')"
Q15077597,P156,Q375664,P22,Q362163,P155,Eric and Eric,Halsten,Stenkil,<ENT0> is followed by <ENT1> .,<ENT1> is the father of <ENT0> .,<ENT0> follows <ENT1> .,Eric and Eric is followed by [MASK] .,[MASK] is the father of Halsten .,Eric and Eric follows [MASK] .,"('P156', 'P22', 'P155')"
Q2101598,P22,Q3266000,P103,Q7411,P1412,Raoul Heertje,Arnold Heertje,Dutch,<ENT1> is the father of <ENT0> .,The native language of <ENT0> is <ENT1> .,<ENT0> translating pled spoken callback fluent <ENT1> .,[MASK] is the father of Raoul Heertje .,The native language of Arnold Heertje is [MASK] .,Raoul Heertje translating pled spoken callback fluent [MASK] .,"('P22', 'P103', 'P1412')"
Q7607311,P159,Q84,P1376,Q145,P17,Stemcor,London,United Kingdom,The headquarter of <ENT0> is in <ENT1> .,<ENT0> is the capital of <ENT1> .,<ENT0> is located in <ENT1> .,The headquarter of Stemcor is in [MASK] .,London is the capital of [MASK] .,Stemcor is located in [MASK] .,"('P159', 'P1376', 'P17')"
Q313124,P22,Q158861,P3373,Q467882,P25,King Prajadhipok (Rama VII),King Chulalongkorn,Saovabha,<ENT1> is the father of <ENT0> .,<ENT0> is sibling of <ENT1>.,<ENT1> is the mother of <ENT0> .,[MASK] is the father of King Prajadhipok (Rama VII) .,King Chulalongkorn is sibling of [MASK].,[MASK] is the mother of King Prajadhipok (Rama VII) .,"('P22', 'P3373', 'P25')"
Q3431187,P19,Q183,P530,Q35,P27,Carl Theodor Sørensen,Germany,Danish,<ENT0> was born in <ENT1> .,<ENT0> maintains diplomatic relations with <ENT1> .,<ENT0> is <ENT1> citizen .,Carl Theodor Sørensen was born in [MASK] .,Germany maintains diplomatic relations with [MASK] .,Carl Theodor Sørensen is [MASK] citizen .,"('P19', 'P530', 'P27')"
Q6271169,P127,Q168515,P159,Q23337,P131,Jon M. Huntsman Center,Utah,"Salt Lake City, Utah",<ENT0> is owned by <ENT1> .,The headquarter of <ENT0> is in <ENT1> .,<ENT0> is located in <ENT1> .,Jon M. Huntsman Center is owned by [MASK] .,The headquarter of Utah is in [MASK] .,Jon M. Huntsman Center is located in [MASK] .,"('P127', 'P159', 'P131')"
Q577024,P69,Q193196,P131,Q84,P937,Jesse Norman,University College London,London,<ENT0> is educated at <ENT1> .,<ENT0> is located in <ENT1> .,<ENT0> used to work in <ENT1> .,Jesse Norman is educated at [MASK] .,University College London is located in [MASK] .,Jesse Norman used to work in [MASK] .,"('P69', 'P131', 'P937')"
Q80290,P17,Q148,P36,Q956,P361,Imperial Palace,PRC,Beijing,<ENT0> is located in <ENT1> .,The capital of <ENT0> is <ENT1> .,<ENT0> is part of <ENT1> .,Imperial Palace is located in [MASK] .,The capital of PRC is [MASK] .,Imperial Palace is part of [MASK] .,"('P17', 'P36', 'P361')"
Q787914,P39,Q49476,P279,Q29182,P39,Gustavo Martínez Frías,Archbishop,bishop,<ENT0> has the position of <ENT1> .,<ENT0> is a subclass of <ENT1> .,<ENT0> has the position of <ENT1> .,Gustavo Martínez Frías has the position of [MASK] .,Archbishop is a subclass of [MASK] .,Gustavo Martínez Frías has the position of [MASK] .,"('P39', 'P279', 'P39')"
Q2992575,P802,Q192331,P69,Q27621,P108,Izmail Sreznevsky,Nikolai Chernyshevsky,Petersburg University,<ENT1> is the student of <ENT0> .,<ENT0> is educated at <ENT1> .,<ENT0> works for <ENT1> .,[MASK] is the student of Izmail Sreznevsky .,Nikolai Chernyshevsky is educated at [MASK] .,Izmail Sreznevsky works for [MASK] .,"('P802', 'P69', 'P108')"
Q276936,P53,Q1129036,P17,Q1028,P27,Abdelhafid,alaouite,Morocco,<ENT0> has the family <ENT1> .,<ENT0> is located in <ENT1> .,<ENT0> is <ENT1> citizen .,Abdelhafid has the family [MASK] .,alaouite is located in [MASK] .,Abdelhafid is [MASK] citizen .,"('P53', 'P17', 'P27')"
Q155178,P40,Q152099,P155,Q17142,P26,Queen Olga,Constantine I,King George I,<ENT1> is the child of <ENT0> .,<ENT0> follows <ENT1> .,<ENT0> is spouse of <ENT1>.,[MASK] is the child of Queen Olga .,Constantine I follows [MASK] .,Queen Olga is spouse of [MASK].,"('P40', 'P155', 'P26')"
Q1327591,P3373,Q1149222,P156,Q1196041,P3373,Emperor Wu,Emperor Xiaomin,Emperor Ming,<ENT0> is sibling of <ENT1>.,<ENT0> is followed by <ENT1> .,<ENT0> is sibling of <ENT1>.,Emperor Wu is sibling of [MASK].,Emperor Xiaomin is followed by [MASK] .,Emperor Wu is sibling of [MASK].,"('P3373', 'P156', 'P3373')"
Q7784136,P22,Q3315521,P40,Q3482707,P3373,Thihathura II of Ava,Minkhaung II,Narapati II,<ENT1> is the father of <ENT0> .,<ENT1> is the child of <ENT0> .,<ENT0> is sibling of <ENT1>.,[MASK] is the father of Thihathura II of Ava .,[MASK] is the child of Minkhaung II .,Thihathura II of Ava is sibling of [MASK].,"('P22', 'P40', 'P3373')"
Q18638370,P127,Q956,P131,Q148,P17,Olympic Park Observation Tower,Beijing,PRC,<ENT0> is owned by <ENT1> .,<ENT0> is located in <ENT1> .,<ENT0> is located in <ENT1> .,Olympic Park Observation Tower is owned by [MASK] .,Beijing is located in [MASK] .,Olympic Park Observation Tower is located in [MASK] .,"('P127', 'P131', 'P17')"
Q257290,P361,Q338199,P527,Q645398,P155,Santonian,Late Cretaceous,Coniacian,<ENT0> is part of <ENT1> .,<ENT0> consists of <ENT1> .,<ENT0> follows <ENT1> .,Santonian is part of [MASK] .,Late Cretaceous consists of [MASK] .,Santonian follows [MASK] .,"('P361', 'P527', 'P155')"
Q2994546,P706,Q217,P47,Q212,P706,Penkovka culture,Moldova,Ukraine,<ENT0> is located on <ENT1> .,<ENT0> shares border with <ENT1> .,<ENT0> is located on <ENT1> .,Penkovka culture is located on [MASK] .,Moldova shares border with [MASK] .,Penkovka culture is located on [MASK] .,"('P706', 'P47', 'P706')"
Q1329269,P361,Q49117,P131,Q1345,P159,Wharton School,Pennsylvania,Philadelphia,<ENT0> is part of <ENT1> .,<ENT0> is located in <ENT1> .,The headquarter of <ENT0> is in <ENT1> .,Wharton School is part of [MASK] .,Pennsylvania is located in [MASK] .,The headquarter of Wharton School is in [MASK] .,"('P361', 'P131', 'P159')"
Q897533,P127,Q19607,P159,Q42448,P131,Bramall Lane,Sheffield United,"Sheffield, England",<ENT0> is owned by <ENT1> .,The headquarter of <ENT0> is in <ENT1> .,<ENT0> is located in <ENT1> .,Bramall Lane is owned by [MASK] .,The headquarter of Sheffield United is in [MASK] .,Bramall Lane is located in [MASK] .,"('P127', 'P159', 'P131')"
Q4302061,P140,Q9585,P279,Q432,P140,Ghufran Ma'ab,Shiite,Islam,<ENT0> is affiliated with the <ENT1> religion .,<ENT0> is a subclass of <ENT1> .,<ENT0> is affiliated with the <ENT1> religion .,Ghufran Ma'ab is affiliated with the [MASK] religion .,Shiite is a subclass of [MASK] .,Ghufran Ma'ab is affiliated with the [MASK] religion .,"('P140', 'P279', 'P140')"
Q1085,P47,Q188399,P17,Q213,P1376,Prague,Central Bohemian Region,Czech Republic,<ENT0> shares border with <ENT1> .,<ENT0> is located in <ENT1> .,<ENT0> is the capital of <ENT1> .,Prague shares border with [MASK] .,Central Bohemian Region is located in [MASK] .,Prague is the capital of [MASK] .,"('P47', 'P17', 'P1376')"
Q545437,P40,Q503057,P155,Q514878,P3373,Ceol,Cynegils,Ceolwulf,<ENT1> is the child of <ENT0> .,<ENT0> follows <ENT1> .,<ENT0> is sibling of <ENT1>.,[MASK] is the child of Ceol .,Cynegils follows [MASK] .,Ceol is sibling of [MASK].,"('P40', 'P155', 'P3373')"
Q1058344,P17,Q717,P36,Q1533,P138,Simón Bolívar International Airport (Venezuela),Venezuela,"Caracas, Venezuela",<ENT0> is located in <ENT1> .,The capital of <ENT0> is <ENT1> .,<ENT0> is named after <ENT1> .,Simón Bolívar International Airport (Venezuela) is located in [MASK] .,The capital of Venezuela is [MASK] .,Simón Bolívar International Airport (Venezuela) is named after [MASK] .,"('P17', 'P36', 'P138')"
Q188526,P937,Q649,P190,Q64,P937,Marina Tsvetaeva,Moscow,Berlin,<ENT0> used to work in <ENT1> .,<ENT0> and <ENT1> are twin cities .,<ENT0> used to work in <ENT1> .,Marina Tsvetaeva used to work in [MASK] .,Moscow and [MASK] are twin cities .,Marina Tsvetaeva used to work in [MASK] .,"('P937', 'P190', 'P937')"
Q734,P30,Q18,P150,Q730,P47,Guyana,South America,Suriname,<ENT0> is located in <ENT1> .,<ENT0> contains the administrative territorial entity <ENT1> .,<ENT0> shares border with <ENT1> .,Guyana is located in [MASK] .,South America contains the administrative territorial entity [MASK] .,Guyana shares border with [MASK] .,"('P30', 'P150', 'P47')"
Q4612,P937,Q64,P190,Q90,P20,Dietrich,Berlin,Paris,<ENT0> used to work in <ENT1> .,<ENT0> and <ENT1> are twin cities .,<ENT0> died in <ENT1> .,Dietrich used to work in [MASK] .,Berlin and [MASK] are twin cities .,Dietrich died in [MASK] .,"('P937', 'P190', 'P20')"
Q3922159,P159,Q60,P1376,Q30,P17,Prism Records,New York City,USA,The headquarter of <ENT0> is in <ENT1> .,<ENT0> is the capital of <ENT1> .,<ENT0> is located in <ENT1> .,The headquarter of Prism Records is in [MASK] .,New York City is the capital of [MASK] .,Prism Records is located in [MASK] .,"('P159', 'P1376', 'P17')"
Q228611,P551,Q1524,P1376,Q41,P27,Melina Mercouri,Athens,Greek islands,<ENT0> resides in <ENT1> .,<ENT0> is the capital of <ENT1> .,<ENT0> is <ENT1> citizen .,Melina Mercouri resides in [MASK] .,Athens is the capital of [MASK] .,Melina Mercouri is [MASK] citizen .,"('P551', 'P1376', 'P27')"
Q4832857,P17,Q41,P150,Q34374,P706,Azoria,Greek islands,Crete,<ENT0> is located in <ENT1> .,<ENT0> contains the administrative territorial entity <ENT1> .,<ENT0> is located on <ENT1> .,Azoria is located in [MASK] .,Greek islands contains the administrative territorial entity [MASK] .,Azoria is located on [MASK] .,"('P17', 'P150', 'P706')"
Q183,P530,Q750,P463,Q1065,P361,Germany,Bolivia,United Nations,<ENT0> maintains diplomatic relations with <ENT1> .,<ENT0> is a member of <ENT1> .,<ENT0> is part of <ENT1> .,Germany maintains diplomatic relations with [MASK] .,Bolivia is a member of [MASK] .,Germany is part of [MASK] .,"('P530', 'P463', 'P361')"
Q4039264,P138,Q326383,P27,Q30,P495,Garfunkel and Oates,John Oates,USA,<ENT0> is named after <ENT1> .,<ENT0> is <ENT1> citizen .,<ENT0> was created in <ENT1> .,Garfunkel and Oates is named after [MASK] .,John Oates is [MASK] citizen .,Garfunkel and Oates was created in [MASK] .,"('P138', 'P27', 'P495')"
Q873368,P361,Q873675,P17,Q869,P1001,Cabinet of Thailand,Royal Thai Government,Thailand,<ENT0> is part of <ENT1> .,<ENT0> is located in <ENT1> .,<ENT0> is a legal term in <ENT1> .,Cabinet of Thailand is part of [MASK] .,Royal Thai Government is located in [MASK] .,Cabinet of Thailand is a legal term in [MASK] .,"('P361', 'P17', 'P1001')"
Q326913,P131,Q16289,P150,Q326883,P47,Telve di Sopra,Trento,Telve,<ENT0> is located in <ENT1> .,<ENT0> contains the administrative territorial entity <ENT1> .,<ENT0> shares border with <ENT1> .,Telve di Sopra is located in [MASK] .,Trento contains the administrative territorial entity [MASK] .,Telve di Sopra shares border with [MASK] .,"('P131', 'P150', 'P47')"
Q4852238,P641,Q204632,P495,Q27,P17,Kickhams,Gaelic Football,Irish,<ENT0> plays the sport <ENT1> .,<ENT0> was created in <ENT1> .,<ENT0> is located in <ENT1> .,Kickhams plays the sport [MASK] .,Gaelic Football was created in [MASK] .,Kickhams is located in [MASK] .,"('P641', 'P495', 'P17')"
Q183187,P155,Q208301,P19,Q3692,P20,King Fahd,King Khalid,Riyadh,<ENT0> follows <ENT1> .,<ENT0> was born in <ENT1> .,<ENT0> died in <ENT1> .,King Fahd follows [MASK] .,King Khalid was born in [MASK] .,King Fahd died in [MASK] .,"('P155', 'P19', 'P20')"
Q437157,P26,Q332347,P937,Q84,P20,Valerie Hobson,Profumo,London,<ENT0> is spouse of <ENT1>.,<ENT0> used to work in <ENT1> .,<ENT0> died in <ENT1> .,Valerie Hobson is spouse of [MASK].,Profumo used to work in [MASK] .,Valerie Hobson died in [MASK] .,"('P26', 'P937', 'P20')"
Q719025,P176,Q156644,P17,Q30,P495,GBU-16 Paveway II,Raytheon,USA,<ENT0> is produced by <ENT1> .,<ENT0> is located in <ENT1> .,<ENT0> was created in <ENT1> .,GBU-16 Paveway II is produced by [MASK] .,Raytheon is located in [MASK] .,GBU-16 Paveway II was created in [MASK] .,"('P176', 'P17', 'P495')"
Q165481,P17,Q252,P47,Q833,P17,Greater Sunda Islands,Indonesia,Malaysia,<ENT0> is located in <ENT1> .,<ENT0> shares border with <ENT1> .,<ENT0> is located in <ENT1> .,Greater Sunda Islands is located in [MASK] .,Indonesia shares border with [MASK] .,Greater Sunda Islands is located in [MASK] .,"('P17', 'P47', 'P17')"
Q1937859,P106,Q191633,P17,Q17,P27,Mohiro Kitoh,manga artist,Japan,<ENT0> is a <ENT1> by profession .,<ENT0> is located in <ENT1> .,<ENT0> is <ENT1> citizen .,Mohiro Kitoh is a [MASK] by profession .,manga artist is located in [MASK] .,Mohiro Kitoh is [MASK] citizen .,"('P106', 'P17', 'P27')"
Q9337,P36,Q239,P1376,Q31,P17,Flanders,Brussels,Belgium,The capital of <ENT0> is <ENT1> .,<ENT0> is the capital of <ENT1> .,<ENT0> is located in <ENT1> .,The capital of Flanders is [MASK] .,Brussels is the capital of [MASK] .,Flanders is located in [MASK] .,"('P36', 'P1376', 'P17')"
Q2717530,P1001,Q34,P47,Q33,P1001,Finnish–Swedish border,Sweden,Finland,<ENT0> is a legal term in <ENT1> .,<ENT0> shares border with <ENT1> .,<ENT0> is a legal term in <ENT1> .,Finnish–Swedish border is a legal term in [MASK] .,Sweden shares border with [MASK] .,Finnish–Swedish border is a legal term in [MASK] .,"('P1001', 'P47', 'P1001')"
Q443850,P22,Q4795164,P26,Q230184,P25,Dinah Manoff,Arnold Manoff,Lee Grant,<ENT1> is the father of <ENT0> .,<ENT0> is spouse of <ENT1>.,<ENT1> is the mother of <ENT0> .,[MASK] is the father of Dinah Manoff .,Arnold Manoff is spouse of [MASK].,[MASK] is the mother of Dinah Manoff .,"('P22', 'P26', 'P25')"
Q550806,P20,Q90,P1376,Q142,P27,Roland Topor,Paris,France,<ENT0> died in <ENT1> .,<ENT0> is the capital of <ENT1> .,<ENT0> is <ENT1> citizen .,Roland Topor died in [MASK] .,Paris is the capital of [MASK] .,Roland Topor is [MASK] citizen .,"('P20', 'P1376', 'P27')"
Q867126,P36,Q3238,P1376,Q783,P17,Francisco Morazán Department,Tegucigalpa,Honduran,The capital of <ENT0> is <ENT1> .,<ENT0> is the capital of <ENT1> .,<ENT0> is located in <ENT1> .,The capital of Francisco Morazán Department is [MASK] .,Tegucigalpa is the capital of [MASK] .,Francisco Morazán Department is located in [MASK] .,"('P36', 'P1376', 'P17')"
Q5881259,P740,Q1930,P1376,Q16,P27,Hollerado,Ottawa,Canada,<ENT0> was founded in <ENT1> .,<ENT0> is the capital of <ENT1> .,<ENT0> is <ENT1> citizen .,Hollerado was founded in [MASK] .,Ottawa is the capital of [MASK] .,Hollerado is [MASK] citizen .,"('P740', 'P1376', 'P27')"
Q2900939,P1412,Q9288,P17,Q801,P20,Rostam Bastuni,Hebrew,Israel,<ENT0> translating pled spoken callback fluent <ENT1> .,<ENT0> is located in <ENT1> .,<ENT0> died in <ENT1> .,Rostam Bastuni translating pled spoken callback fluent [MASK] .,Hebrew is located in [MASK] .,Rostam Bastuni died in [MASK] .,"('P1412', 'P17', 'P20')"
Q3980864,P1344,Q8531,P156,Q8544,P1344,Tania Seino,"Atlanta, Georgia",2000 Summer Olympics,<ENT0> participated in <ENT1> .,<ENT0> is followed by <ENT1> .,<ENT0> participated in <ENT1> .,Tania Seino participated in [MASK] .,"Atlanta, Georgia is followed by [MASK] .",Tania Seino participated in [MASK] .,"('P1344', 'P156', 'P1344')"
Q5492493,P27,Q213,P150,Q1085,P20,František Brož,Czech Republic,Prague,<ENT0> is <ENT1> citizen .,<ENT0> contains the administrative territorial entity <ENT1> .,<ENT0> died in <ENT1> .,František Brož is [MASK] citizen .,Czech Republic contains the administrative territorial entity [MASK] .,František Brož died in [MASK] .,"('P27', 'P150', 'P20')"
Q3277702,P138,Q170462,P131,Q833,P17,Sarawak Stadium,Sarawak,Malaysia,<ENT0> is named after <ENT1> .,<ENT0> is located in <ENT1> .,<ENT0> is located in <ENT1> .,Sarawak Stadium is named after [MASK] .,Sarawak is located in [MASK] .,Sarawak Stadium is located in [MASK] .,"('P138', 'P131', 'P17')"
Q521453,P17,Q20,P36,Q585,P127,Dælenenga idrettspark,Norway,Oslo,<ENT0> is located in <ENT1> .,The capital of <ENT0> is <ENT1> .,<ENT0> is owned by <ENT1> .,Dælenenga idrettspark is located in [MASK] .,The capital of Norway is [MASK] .,Dælenenga idrettspark is owned by [MASK] .,"('P17', 'P36', 'P127')"
Q939325,P495,Q27,P47,Q145,P495,Ella Enchanted (film),Irish,United Kingdom,<ENT0> was created in <ENT1> .,<ENT0> shares border with <ENT1> .,<ENT0> was created in <ENT1> .,Ella Enchanted (film) was created in [MASK] .,Irish shares border with [MASK] .,Ella Enchanted (film) was created in [MASK] .,"('P495', 'P47', 'P495')"
Q1376528,P463,Q1971373,P361,Q79854,P102,Alexei Kirichenko,Central Committee,Communist Party,<ENT0> is a member of <ENT1> .,<ENT0> is part of <ENT1> .,<ENT0> is member of political party <ENT1> .,Alexei Kirichenko is a member of [MASK] .,Central Committee is part of [MASK] .,Alexei Kirichenko is member of political party [MASK] .,"('P463', 'P361', 'P102')"
Q731938,P17,Q145,P36,Q84,P740,AstraZeneca,United Kingdom,London,<ENT0> is located in <ENT1> .,The capital of <ENT0> is <ENT1> .,<ENT0> was founded in <ENT1> .,AstraZeneca is located in [MASK] .,The capital of United Kingdom is [MASK] .,AstraZeneca was founded in [MASK] .,"('P17', 'P36', 'P740')"
Q124179,P740,Q60,P17,Q30,P495,Kiss (band),New York City,USA,<ENT0> was founded in <ENT1> .,<ENT0> is located in <ENT1> .,<ENT0> was created in <ENT1> .,Kiss (band) was founded in [MASK] .,New York City is located in [MASK] .,Kiss (band) was created in [MASK] .,"('P740', 'P17', 'P495')"
Q23800,P131,Q233,P1589,Q4918,P206,Valletta,Malta,Mediterranean Sea,<ENT0> is located in <ENT1> .,<ENT1> is the lowest point of <ENT0> region .,<ENT0> is located in or next to <ENT1> .,Valletta is located in [MASK] .,[MASK] is the lowest point of Malta region .,Valletta is located in or next to [MASK] .,"('P131', 'P1589', 'P206')"
Q170302,P800,Q446972,P364,Q9168,P103,Saadi,Bostan,Persian,<ENT1> is the notable work of <ENT0> .,<ENT0> population language predomin smoker installer <ENT1> .,The native language of <ENT0> is <ENT1> .,[MASK] is the notable work of Saadi .,Bostan population language predomin smoker installer [MASK] .,The native language of Saadi is [MASK] .,"('P800', 'P364', 'P103')"
Q235063,P800,Q713628,P17,Q30,P27,Maya Lin,Vietnam Veterans Memorial,USA,<ENT1> is the notable work of <ENT0> .,<ENT0> is located in <ENT1> .,<ENT0> is <ENT1> citizen .,[MASK] is the notable work of Maya Lin .,Vietnam Veterans Memorial is located in [MASK] .,Maya Lin is [MASK] citizen .,"('P800', 'P17', 'P27')"
Q1348708,P40,Q593626,P20,Q13362,P19,Ercole I d'Este,Isabella d'Este,Ferrara,<ENT1> is the child of <ENT0> .,<ENT0> died in <ENT1> .,<ENT0> was born in <ENT1> .,[MASK] is the child of Ercole I d'Este .,Isabella d'Este died in [MASK] .,Ercole I d'Este was born in [MASK] .,"('P40', 'P20', 'P19')"
Q335525,P40,Q379984,P20,Q13695,P19,Acamapichtli,Huitzilihuitl,Tenochtitlan,<ENT1> is the child of <ENT0> .,<ENT0> died in <ENT1> .,<ENT0> was born in <ENT1> .,[MASK] is the child of Acamapichtli .,Huitzilihuitl died in [MASK] .,Acamapichtli was born in [MASK] .,"('P40', 'P20', 'P19')"
Q655118,P710,Q57959,P1344,Q33881,P31,2005 Tour de France,Jan Ullrich,Tour de France,<ENT1> is a participant of <ENT0> .,<ENT0> participated in <ENT1> .,<ENT0> is a <ENT1> .,[MASK] is a participant of 2005 Tour de France .,Jan Ullrich participated in [MASK] .,2005 Tour de France is a [MASK] .,"('P710', 'P1344', 'P31')"
Q458,P150,Q27,P530,Q142,P150,EU,Irish,France,<ENT0> contains the administrative territorial entity <ENT1> .,<ENT0> maintains diplomatic relations with <ENT1> .,<ENT0> contains the administrative territorial entity <ENT1> .,EU contains the administrative territorial entity [MASK] .,Irish maintains diplomatic relations with [MASK] .,EU contains the administrative territorial entity [MASK] .,"('P150', 'P530', 'P150')"
Q7208992,P138,Q7866225,P31,Q14978,P279,Polar-class icebreaker,USCGC Polar Sea (WAGB-11),icebreaker,<ENT0> is named after <ENT1> .,<ENT0> is a <ENT1> .,<ENT0> is a subclass of <ENT1> .,Polar-class icebreaker is named after [MASK] .,USCGC Polar Sea (WAGB-11) is a [MASK] .,Polar-class icebreaker is a subclass of [MASK] .,"('P138', 'P31', 'P279')"
Q331153,P138,Q110218,P17,Q924,P131,Mwanza Region,Mwanza,Tanzania,<ENT0> is named after <ENT1> .,<ENT0> is located in <ENT1> .,<ENT0> is located in <ENT1> .,Mwanza Region is named after [MASK] .,Mwanza is located in [MASK] .,Mwanza Region is located in [MASK] .,"('P138', 'P17', 'P131')"
Q350498,P155,Q260543,P40,Q329826,P156,Sigurd,Harald Gille,Øystein Haraldsson,<ENT0> follows <ENT1> .,<ENT1> is the child of <ENT0> .,<ENT0> is followed by <ENT1> .,Sigurd follows [MASK] .,[MASK] is the child of Harald Gille .,Sigurd is followed by [MASK] .,"('P155', 'P40', 'P156')"
Q501680,P20,Q499189,P17,Q30,P495,Steven Stayner,"Merced, California",USA,<ENT0> died in <ENT1> .,<ENT0> is located in <ENT1> .,<ENT0> was created in <ENT1> .,Steven Stayner died in [MASK] .,"Merced, California is located in [MASK] .",Steven Stayner was created in [MASK] .,"('P20', 'P17', 'P495')"
Q6444067,P407,Q5885,P17,Q668,P495,Kumudam,Tamil film,India,<ENT0> was written in <ENT1> .,<ENT0> is located in <ENT1> .,<ENT0> was created in <ENT1> .,Kumudam was written in [MASK] .,Tamil film is located in [MASK] .,Kumudam was created in [MASK] .,"('P407', 'P17', 'P495')"
Q4301,P131,Q329261,P17,Q924,P131,Arusha,Arusha Region,Tanzania,<ENT0> is located in <ENT1> .,<ENT0> is located in <ENT1> .,<ENT0> is located in <ENT1> .,Arusha is located in [MASK] .,Arusha Region is located in [MASK] .,Arusha is located in [MASK] .,"('P131', 'P17', 'P131')"
Q1509619,P710,Q12560,P155,Q12544,P710,Battle of Bapheus,Ottoman Empire,Byzantines,<ENT1> is a participant of <ENT0> .,<ENT0> follows <ENT1> .,<ENT1> is a participant of <ENT0> .,[MASK] is a participant of Battle of Bapheus .,Ottoman Empire follows [MASK] .,[MASK] is a participant of Battle of Bapheus .,"('P710', 'P155', 'P710')"
Q6902246,P69,Q49112,P527,Q1143289,P69,Monroe Price,Yale University,Yale Law School,<ENT0> is educated at <ENT1> .,<ENT0> consists of <ENT1> .,<ENT0> is educated at <ENT1> .,Monroe Price is educated at [MASK] .,Yale University consists of [MASK] .,Monroe Price is educated at [MASK] .,"('P69', 'P527', 'P69')"
Q2009,P138,Q104437,P131,Q797,P47,Yukon Territory,Yukon River,Alaska,<ENT0> is named after <ENT1> .,<ENT0> is located in <ENT1> .,<ENT0> shares border with <ENT1> .,Yukon Territory is named after [MASK] .,Yukon River is located in [MASK] .,Yukon Territory shares border with [MASK] .,"('P138', 'P131', 'P47')"
Q44228,P40,Q438856,P20,Q5690,P27,Leonidas I,Pleistarchus,Sparta,<ENT1> is the child of <ENT0> .,<ENT0> died in <ENT1> .,<ENT0> is <ENT1> citizen .,[MASK] is the child of Leonidas I .,Pleistarchus died in [MASK] .,Leonidas I is [MASK] citizen .,"('P40', 'P20', 'P27')"
Q111168,P36,Q16557,P131,Q111174,P47,"Dallas County, Texas","Dallas, Texas",Collin County,The capital of <ENT0> is <ENT1> .,<ENT0> is located in <ENT1> .,<ENT0> shares border with <ENT1> .,"The capital of Dallas County, Texas is [MASK] .","Dallas, Texas is located in [MASK] .","Dallas County, Texas shares border with [MASK] .","('P36', 'P131', 'P47')"
Q683620,P39,Q693032,P1001,Q1391,P20,Thomas Watkins Ligon,Maryland Governor,Maryland,<ENT0> has the position of <ENT1> .,<ENT0> is a legal term in <ENT1> .,<ENT0> died in <ENT1> .,Thomas Watkins Ligon has the position of [MASK] .,Maryland Governor is a legal term in [MASK] .,Thomas Watkins Ligon died in [MASK] .,"('P39', 'P1001', 'P20')"
Q4071609,P20,Q656,P150,Q155863,P19,Anna Astakhova,Leningrad,Kronstadt,<ENT0> died in <ENT1> .,<ENT0> contains the administrative territorial entity <ENT1> .,<ENT0> was born in <ENT1> .,Anna Astakhova died in [MASK] .,Leningrad contains the administrative territorial entity [MASK] .,Anna Astakhova was born in [MASK] .,"('P20', 'P150', 'P19')"
Q414,P30,Q18,P150,Q77,P47,Argentina,South America,Uruguay,<ENT0> is located in <ENT1> .,<ENT0> contains the administrative territorial entity <ENT1> .,<ENT0> shares border with <ENT1> .,Argentina is located in [MASK] .,South America contains the administrative territorial entity [MASK] .,Argentina shares border with [MASK] .,"('P30', 'P150', 'P47')"
Q228,P37,Q7026,P17,Q142,P47,Andorra,Catalan,France,The official language of <ENT0> is <ENT1> .,<ENT0> is located in <ENT1> .,<ENT0> shares border with <ENT1> .,The official language of Andorra is [MASK] .,Catalan is located in [MASK] .,Andorra shares border with [MASK] .,"('P37', 'P17', 'P47')"
